,Title,Published_date,Views,Likes,Favourite,Comments,Month
530,Perceptron Algorithm in Sklearn,2020-08-07,1248,13,0,1,Aug
531,Perceptron Trick,2020-08-07,990,28,0,7,Aug
532,Perceptron Geometric Intuition,2020-08-07,587,15,0,1,Aug
533,Perceptron Introduction,2020-08-07,2191,37,0,2,Aug
534,CSS Media Queries,2020-08-07,239,5,0,0,Aug
535,CSS Grids,2020-08-07,203,6,0,1,Aug
536,Backpropogation Explained,2020-08-07,73,2,0,1,Aug
537,Disadvantages of Cosine Similarity,2020-08-07,467,3,0,0,Aug
538,Gradient Descent from Scratch in Python,2020-08-07,193,10,0,0,Aug
539,CSS Flexbox,2020-08-07,227,5,0,0,Aug
540,CSS Combinators and Pseudo Elements,2020-08-07,147,4,0,0,Aug
541,CSS Transformations,2020-08-07,140,3,0,0,Aug
542,CSS Transitions,2020-08-07,153,2,0,0,Aug
543,CSS Animation Part 2,2020-08-07,131,3,0,0,Aug
544,CSS Animation Part 1,2020-08-07,199,4,0,0,Aug
545,Kernel Trick in SVM | Geometric Intuition,2020-08-07,21264,535,0,15,Aug
546,Kernel Trick in SVM | Code Example,2020-08-07,16139,464,0,32,Aug
547,Styling Forms using CSS,2020-08-07,344,7,0,0,Aug
548,Styling Tables,2020-08-07,330,7,0,0,Aug
549,CSS Units,2020-08-07,354,12,0,0,Aug
550,CSS Navigation Bars and Side Navigation Bars,2020-08-07,355,3,0,2,Aug
551,Dropdowns in CSS,2020-08-07,502,9,0,1,Aug
552,Mathematics of Support Vector Machine | Soft Margin SVM,2020-08-07,27340,696,0,36,Aug
553,Support Vector Machine | Code Sample,2020-08-07,16130,293,0,16,Aug
554,Mathematical Prerequisites for Deep Learning,2020-07-19,424,18,0,1,Jul
555,How is the Internet so fast? | Fundamentals of Web Development | Part 12,2020-07-13,725,45,0,4,Jul
556,Transmission Control Protocol (TCP) | Fundamentals of Web Development | Part 11,2020-07-13,786,25,0,2,Jul
557,IPV4 Vs IPV6 | Fundamentals of Web Development | Part 8,2020-07-13,838,31,0,0,Jul
558,Domain Name Server | Fundamentals of Web Development | Part 10,2020-07-13,942,33,0,1,Jul
559,Public IP Vs Private IP | Fundamentals of Web Development  | Part 9,2020-07-13,905,28,0,5,Jul
560,How does the Internet work? | Fundamentals of Web Development | Part 6,2020-07-13,1112,36,0,1,Jul
561,Peer to Peer Networks | Fundamentals of Web Development | Part 5,2020-07-13,1261,50,0,4,Jul
562,Client Server Architecture | Fundamentals of Web Development | Part 4,2020-07-13,1815,57,0,2,Jul
563,CSS Background Image Property,2020-07-10,625,16,0,0,Jul
564,CSS Selectors,2020-07-10,85,1,0,0,Jul
565,Comments in CSS,2020-07-10,429,7,0,0,Jul
566,Implementing CSS,2020-07-10,638,16,0,0,Jul
567,Introduction to CSS,2020-07-10,2355,30,0,1,Jul
568,Mathematics of SVM | Support Vector Machines | Hard margin SVM,2020-07-10,53566,1357,0,95,Jul
569,Support Vector Machines | Geometric Intuition,2020-07-10,55967,1086,0,37,Jul
570,Equation of a Hyper-plane in N dimensions,2020-07-10,36581,959,0,53,Jul
571,Logistic Regression | Geometric Intuition,2020-07-10,5330,157,0,6,Jul
572,Logictic Regression | Introduction,2020-07-10,1862,41,0,3,Jul
573,"Links, Images and Attributes",2020-07-10,1199,45,0,1,Jul
574,"Head, Paragraph and Typography",2020-07-10,1344,49,0,3,Jul
575,"Doctype, Basic Layout and Comments",2020-07-10,1248,44,0,0,Jul
576,HTML Basic Syntax,2020-07-10,1423,36,0,0,Jul
577,HTML Introduction and Setup,2020-07-10,4352,81,0,4,Jul
578,What is a Server? | Fundamentals of Web Development | Part 3,2020-07-09,1490,76,0,5,Jul
579,Email Spam Classifier | Project Ideas #4,2020-07-02,4745,70,0,7,Jul
580,6 Ways To Build A Kickass Portfolio,2020-07-01,277,20,0,2,Jul
581,Top 5 mistakes in Group Discussion | Freshers | Campus Placement,2020-06-30,190,17,0,2,Jun
582,Components of Internet | Fundamentals of Web Development | Part 2,2020-06-30,1863,71,0,2,Jun
583,What is Internet? | Fundamentals of Web Development | Part 1,2020-06-26,7871,216,0,5,Jun
584,Movie Recommender System | Project #4,2020-06-23,743,22,0,4,Jun
585,Wallpaper Viewer Application in Android | Android Development for Beginners | [Hindi],2020-06-21,161,8,0,0,Jun
586,Building a Web Browser in Android | Android Development for Beginners | [Hindi],2020-06-21,156,2,0,0,Jun
587,Checkbox in Android | Android Development for Beginners | [Hindi],2020-06-21,693,14,0,0,Jun
588,Context Menu in Android | Android Development for Beginners | [Hindi],2020-06-21,1590,22,0,3,Jun
589,Dialog box in Android | Android Development for Beginners | [Hindi],2020-06-18,128,3,0,0,Jun
590,Pop-up Menu in Android | Android Development for Beginners | [Hindi],2020-06-18,1027,20,0,0,Jun
591,Calculator Project | Android Development for Beginners | [Hindi],2020-06-17,167,2,0,0,Jun
592,Autocomplete Text View | Android Development for Beginners | [Hindi],2020-06-17,416,9,0,0,Jun
593,Creating your First Project | Android Development for Beginners,2020-06-16,428,9,0,2,Jun
594,Installing Android Studio | Android Development for Beginners,2020-06-16,267,5,0,0,Jun
595,Online Group Discussion | Should social media presence be considered while hiring candidates?,2020-06-15,120,3,0,1,Jun
596,The Philosophy of Advertisements | Android Development for Beginners | [Hindi],2020-06-15,317,15,0,1,Jun
597,The Great Android Story | Android Development for Beginners | [Hindi],2020-06-14,298,22,0,1,Jun
598,The Philosophy of Open Source Software | Android Development for Beginners | [Hindi],2020-06-14,1089,39,0,3,Jun
599,Ridge Regression | Code and Analysis,2020-06-13,8532,112,0,12,Jun
600,Introduction to Android | Android Development for Beginners | [Hindi],2020-06-13,895,29,0,4,Jun
601,Quikr Car Price Predictor | Project #2 | Machine Learning,2020-06-11,2648,47,0,2,Jun
602,Ridge Regression | Regularization | Mathematical Intuition,2020-06-11,3679,111,0,19,Jun
603,Kth Largest Element | Algorithms in C,2020-06-11,92,2,0,0,Jun
604,Tower of Hanoi | Algorithms in C,2020-06-10,95,4,0,0,Jun
605,Linear Search | Algorithms in C,2020-06-10,13,0,0,0,Jun
606,Quick Sort | Algorithms in C,2020-06-10,106,4,0,0,Jun
607,Selection Sort | Algorithms in C,2020-06-10,54,2,0,0,Jun
608,Schema Design using MySQL Workbench,2020-06-10,807,10,0,4,Jun
609,Database Lecture | Creating Login & Registration,2020-06-10,461,15,0,1,Jun
610,Linear Regression Part 12 | Polynomial Regression | Intuition and Code Example,2020-06-09,2532,74,0,1,Jun
611,Placement Experience with Suthirtha Saha | SAP Labs | Infosys,2020-06-07,1908,34,0,5,Jun
612,Session on Resume Building,2020-06-07,606,16,0,0,Jun
613,CampusX - Doubt clearance on Git and Github,2020-06-07,305,12,0,1,Jun
614,Problem 19. Lowest Common Ancestor in Binary Search Tree | Programming Questions for Placement,2020-06-06,17,0,0,0,Jun
615,Prob 18. Sum of numbers formed by permutation of given digits | Programming Questions for Placement,2020-06-06,75,0,0,0,Jun
616,Problem 17. Binary Tree to Doubly Linked List | Programming Questions for Placement Preparations,2020-06-06,175,2,0,0,Jun
617,Aaj ki Philosophy | Ek Idea,2020-06-05,288,23,0,0,Jun
618,Bias Variance Trade-off | Overfitting and Underfitting in Machine Learning,2020-06-05,36566,971,0,28,Jun
619,Problem 16. Height of a Special Binary Tree | Programming Questions for Placement Preparation,2020-06-05,79,1,0,0,Jun
620,Problem 15. Find Next Greater Palindrome | Programming Questions for Placement Preparation | CampusX,2020-06-05,3767,36,0,2,Jun
621,Problem 14. Stock Buy Sell to Maximize Profit | Programming Questions for Placement Preparation,2020-06-05,110,3,0,0,Jun
622,Problem 13. Nth Magic Number | Programming Questions for Placement Preparation | CampusX,2020-06-05,198,2,0,0,Jun
623,Aaj ki Philosophy | Robowars ka Falsafa,2020-06-04,245,24,0,2,Jun
624,Aaj ki Philosophy | Hacking ka Attitude,2020-06-04,276,31,0,3,Jun
625,What is an API?,2020-06-04,580,36,0,2,Jun
626,Aaj ki Philosophy | Musical Chairs,2020-06-04,299,35,0,2,Jun
627,Zomato Clone | Web Development Project 1,2020-06-04,1777,41,0,6,Jun
628,Problem 12. Minimum Cost Path | Programming Questions for Placement Preparation | CampusX,2020-06-03,100,0,0,0,Jun
629,Problem 11. Longest Common Subsequence | Programming Questions for Placement Preparation | CampusX,2020-06-03,39,1,0,0,Jun
630,Problem 10. Contiguous Sub Array with Maximum Sum | Programming Questions for Placement Preparation,2020-06-03,58,2,0,0,Jun
631,Regression Project 1 - Quikr Car Price Predictor,2020-06-03,430,2,0,1,Jun
632,Linear Regression Part 11 | R2 and Adjusted R2 | Coefficient of Determination,2020-06-03,4509,106,0,4,Jun
633,Linear Regression Part 9 | Code Example,2020-06-02,3258,75,0,3,Jun
634,Linear Regression Part  3 | General Intuition of OLS,2020-06-02,6520,159,0,6,Jun
635,Problem 9. Implement Queue as a Stack | Programming Questions for Placement Preparation | CampusX,2020-06-02,14,0,0,0,Jun
636,Problem 8. Implement Stack as a Queue | Programming Questions for Placement Preparation | CampusX,2020-06-02,16,0,0,0,Jun
637,Problem 7. Detect and Remove Loop in Linked List | Programming Questions for Placement Preparation,2020-06-02,270,5,0,0,Jun
638,Aaj ki Philosophy | Mexican Wave,2020-06-01,650,78,0,5,Jun
639,Problem 6. Reverse a Linked List | Programming Videos for Placement Preparation | CampusX,2020-06-01,37,0,0,0,Jun
640,Prob 5. Number of Islands in an Undirected Graph | Programming Questions for Placement Preparation,2020-06-01,28,1,0,0,Jun
641,Problem 4. Remove Duplicates from a Linked List | Programming Questions for Placement Preparation,2020-06-01,56,1,0,0,Jun
642,Prob 3. Find Sum of Median of Two Sorted Arrays | Programming Questions for Placement Preparation,2020-05-31,106,1,0,1,May
643,Prob 2. First Non-Repeating Character in a String | Programming Questions for Placement | CampusX,2020-05-31,133,1,0,0,May
644,Problem 1. Find Triplets With Zero Sum | Programming Questions for Placement Preparation | CampusX,2020-05-31,1053,13,0,1,May
645,Bar Charts | Logical Reasoning Part 9,2020-05-31,29,1,0,0,May
646,Pie Charts | Logical Reasoning Part 8,2020-05-31,26,0,0,0,May
647,Table Charts | Logical Reasoning Part 7,2020-05-31,26,1,0,0,May
648,Symbols and Notations | Logical Reasoning Part 5,2020-05-31,124,1,0,0,May
649,Venn Diagrams | Logical Reasoning Part 4,2020-05-31,26,0,0,0,May
650,Coding and Decoding | Logical Reasoning Part 3,2020-05-31,44,1,0,0,May
651,Letters and Symbols | Logical Reasoning Part 2,2020-05-31,112,6,0,0,May
652,Directional Sense | Logical Reasoning Part 1,2020-05-31,132,4,0,0,May
653,GPU V CPU for Deep Learning,2020-05-29,1780,54,0,2,May
654,Introduction to Keras,2020-05-29,1538,63,0,6,May
655,Linear Regression Part 4 | Ordinary Least Squares,2020-05-27,11577,238,0,17,May
656,Prediction in Artificial Neural Network | Deep Learning Part 10,2020-05-26,440,19,0,3,May
657,CampusX Mentorship Program,2020-05-25,833,53,0,4,May
658,How to publish research papers in Machine Learning by Navoneel Chakrabarty,2020-05-24,5520,236,0,7,May
659,How to become a great coder Part 13 - Be the Master of One,2020-05-23,154,11,0,1,May
660,How to become a great coder Part 12 - Breadth of knowledge,2020-05-23,143,7,0,1,May
661,How to become a great coder Part 11 - Document your code and learning,2020-05-23,126,6,0,0,May
662,How to become a great coder Part 10 - Practice and Compete,2020-05-23,110,4,0,0,May
663,How to become a great coder Part 8 - Code Readability,2020-05-23,218,7,0,1,May
664,How to become a great coder Part 9 - Code in a timed environment,2020-05-23,120,2,0,0,May
665,How to become a great coder Part 7 - Debugging,2020-05-23,160,7,0,0,May
666,How to become a great coder Part 6 - Concentration while programming,2020-05-23,190,12,0,1,May
667,How to become a great coder Part 5 - Whiteboarding,2020-05-23,177,7,0,0,May
668,How to become a great coder Part 4 - How to stay motivated?,2020-05-23,192,10,0,1,May
669,How to become a great coder Part 3- Breaking your bigger problem into smaller ones,2020-05-23,252,13,0,1,May
670,How to become a great coder Part 2- Problem solving attitude,2020-05-23,278,16,0,1,May
671,How to become a great coder Part 1 - The learning process,2020-05-23,565,22,0,2,May
672,Future and Careen Prospects in Deep Learning,2020-05-22,32,4,0,0,May
673,History of Deep Learning,2020-05-21,4554,136,0,10,May
674,Machine Learning Vs Deep Learning,2020-05-20,339,24,0,1,May
675,Multi-layered Perceptron | Artificial Neural Networks,2020-05-18,636,16,0,2,May
676,Types of Artificial Neural Network | Course on Deep Learning,2020-05-18,1548,53,0,3,May
677,What is a Perceptron | Neuron V Perceptron | Course on Deep Learning,2020-05-18,6374,123,0,4,May
678,What is Deep Learning | Deep Learning Course,2020-05-18,503,28,0,0,May
679,Course Introduction | Deep Learning,2020-05-18,923,27,0,3,May
680,Classification Metrics in Machine Learning,2020-05-15,837,22,0,0,May
681,Regression Trees | Regression in Decision Trees | Hindi,2020-05-13,20256,536,0,39,May
682,Literals in Python | Python Tutorial #8,2020-05-11,156,3,0,1,May
683,PHP and MySQL CRUD application Part 1,2020-05-11,153,2,0,0,May
684,PHP and MySQL CRUD application Part 2,2020-05-11,68,2,0,0,May
685,SQL queries in PHPMyAdmin,2020-05-11,1275,23,0,4,May
686,PHPMyAdmin for PHP and MySQL,2020-05-11,102,2,0,1,May
687,SQL join queries in PHPMyAdmin,2020-05-11,1047,15,0,3,May
688,Session on Titanic Survival Challenge,2020-05-09,9117,171,0,15,May
689,File Uploads in PHP,2020-05-09,53,0,0,0,May
690,Form Handling in PHP,2020-05-09,1977,24,0,2,May
691,Cookies in PHP,2020-05-09,29,0,0,0,May
692,Sessions in PHP,2020-05-09,46,2,0,1,May
693,Include and Redirect in PHP,2020-05-09,84,2,0,0,May
694,Keywords and Identifiers in Python,2020-05-08,115,5,0,0,May
695,Introduction to PHP,2020-05-08,135,2,0,0,May
696,Installing Wampserver for PHP,2020-05-08,259,1,0,0,May
697,Arrays in PHP,2020-05-08,36,1,0,0,May
698,Functions in PHP,2020-05-08,27,1,0,0,May
699,If-else and Operators in PHP,2020-05-08,56,1,0,0,May
700,Strings functions in PHP,2020-05-08,31,0,0,0,May
701,Loops in PHP,2020-05-08,25,0,0,0,May
702,Variables in PHP,2020-05-08,60,1,0,0,May
703,Switch statements and the die() function in PHP,2020-05-08,48,2,0,0,May
704,Datetime functions in PHP,2020-05-08,60,0,0,0,May
705,Type Conversion in Python | Python Tutorial #6,2020-05-07,137,5,0,0,May
706,Handwriting Classifier using Decision Trees,2020-05-07,5310,111,0,3,May
707,Operators in Java | Java Tutorial #6,2020-05-07,49,1,0,0,May
708,If-else statements in Java | Java Tutorial #7,2020-05-07,32,0,0,0,May
709,Loops in Java | Java Tutorial #8,2020-05-07,20,0,0,0,May
710,Break and Continue in Java | Java Tutorial #9,2020-05-07,25,0,0,0,May
711,Taking user input in Java | Java Tutorial #5,2020-05-07,11,0,0,0,May
712,Variables in Python | Python Tutorial #5,2020-05-06,117,5,0,1,May
713,CSS Selectors,2020-05-06,85,2,0,1,May
714,CSS Positioning,2020-05-06,81,3,0,0,May
715,CSS Layout Tutorial,2020-05-06,76,2,0,0,May
716,CSS Properties Part 2,2020-05-06,69,3,0,0,May
717,CSS Box Model,2020-05-06,9,0,0,0,May
718,CSS Properties Part 1,2020-05-06,128,4,0,0,May
719,Variables in Java | Java Tutorial #3,2020-05-06,47,0,0,0,May
720,Data Types in Java | Java Tutorial #4,2020-05-06,183,1,0,0,May
721,Input function in Python | Python Tutorial #4,2020-05-05,156,5,0,1,May
722,Creating a Pandas Dataset from a MySQL Database | Data Gathering | Data Wrangling Step 1,2020-05-05,4078,80,0,6,May
723,Data Cleaning | Data Wrangling Step 3 | Data Analysis Process,2020-05-05,6355,125,0,9,May
724,EDA on Titanic Dataset | Data Analysis Process,2020-05-05,17699,376,0,11,May
725,Assessing Data | Data Wrangling Step 2 | Data Analysis Process,2020-05-05,6442,162,0,12,May
726,Email Spam Classifier,2020-05-05,7611,166,0,22,May
727,Zomato Price Predictor,2020-05-05,844,43,0,2,May
728,K Means Clustering,2020-05-05,3798,146,0,17,May
729,Clustering Project | Book Recommender System,2020-05-05,29274,694,0,42,May
730,Movie Review Sentiment Analysis Part 3,2020-05-05,6142,162,0,11,May
731,Movie Review Sentiment Analysis Part 2,2020-05-05,10046,172,0,8,May
732,Movie Review Sentiment Analysis Part 1,2020-05-05,12916,262,0,17,May
733,PCA | Why Variance is important in PCA,2020-05-05,1553,39,0,1,May
734,PCA | Problem Formulation,2020-05-05,2098,72,0,4,May
735,Introduction to CSS | CSS for Beginners,2020-05-05,275,4,0,2,May
736,Data types in Python | type() in Python | Python Tutorial #3 | Zero to One,2020-05-04,176,7,0,2,May
737,The Print Function | Python Tutorial #2 | Python for Beginners | Zero to One,2020-05-03,360,8,0,1,May
738,Introduction to Python | Python Tutorial #1 | Python for Beginners | Zero to One,2020-05-01,1199,34,0,4,May
739,Naive Bayes Part 9 | Handling Numerical Data,2020-04-27,8263,241,0,12,Apr
740,Implementing PCA using sklearn | Principal Component Analysis | Machine Learning in Hindi,2020-04-27,3347,71,0,9,Apr
741,Curse of Dimensionality | Hindi,2020-04-26,8015,110,0,5,Apr
742,Session on Web Scraping | Creating a Data-set using Web scraping,2020-04-05,9438,237,0,11,Apr
743,API to Pandas Dataframe | Data Gathering | Data Wrangling Step 1 | Data Analysis Process,2020-04-03,11910,286,0,21,Apr
744,Linked Lists in Python | Part 9 | Deleting a node by value,2020-03-31,191,6,0,2,Mar
745,Linked Lists in Python | Part 8 | Deletion from tail in a Singly Linked List,2020-03-31,118,3,0,0,Mar
746,Linked List in Python | Part 7 | Deletion from head in a Singly Linked List,2020-03-31,145,3,0,0,Mar
747,Making a Corona virus(Covid-19) Dashboard | Session on Dash,2020-03-30,13607,135,0,5,Mar
748,Linked Lists in Python | Part 1 | Introduction to Linked Lists | Arrays Vs Linked List,2020-03-27,922,22,0,1,Mar
749,Linked Lists in Python | Part 6 | Insertion through tail in a Singly Linked List | Placement Prepara,2020-03-27,230,3,0,1,Mar
750,Linked Lists in Python | Part 5 | Insertion after a given node in a Singly Linked List,2020-03-27,293,8,0,1,Mar
751,Linked Lists in Python | Part 4 | Traversal in a Singly Linked List | Placement Preparation,2020-03-27,314,4,0,1,Mar
752,Linked Lists in Python | Part 3 | Insertion from head in a Singly Linked List | Placement Preparatio,2020-03-27,427,7,0,0,Mar
753,Linked Lists in Python | Part 2 | Implementing a Single Node | Placement Preparation,2020-03-27,455,9,0,0,Mar
754,Leftmost Character that doesn't Repeat,2020-03-27,21,0,0,0,Mar
755,Leftmost Character that Repeats,2020-03-27,292,3,0,0,Mar
756,Anagrams,2020-03-27,115,0,0,0,Mar
757,Matplotlib,2020-03-26,8529,195,0,5,Mar
758,Data Visualization using Seaborn | Distplots,2020-03-26,3665,131,0,6,Mar
759,Data Visualization using Seaborn | Pairplots,2020-03-26,2946,91,0,3,Mar
760,Data Visualization using Seaborn | Jointplots,2020-03-26,2677,81,0,3,Mar
761,Data Visualization using Seaborn | Clustermaps,2020-03-24,2858,88,0,2,Mar
762,Data Visualization using Seaborn | Heatmaps,2020-03-24,6899,172,0,2,Mar
763,Data Visualization using Seaborn | Barplots and Countplots,2020-03-24,3558,98,0,3,Mar
764,Data Visualization using Seaborn | Violinplots,2020-03-23,3140,92,0,1,Mar
765,Data Visualization using Seaborn | Boxplot,2020-03-23,4069,126,0,6,Mar
766,Data Visualization using Seaborn | Categorical Scatterplots | Stripplots and Swarmplots,2020-03-23,5670,128,0,13,Mar
767,Data Visualization using Seaborn | Scatter Plots,2020-03-22,13724,254,0,6,Mar
768,Central Limit Theorem,2020-03-18,422,28,0,2,Mar
769,Central Limit Theorem - Proof,2020-03-18,3399,109,0,12,Mar
770,Z-score and Z-tables,2020-03-18,3670,100,0,3,Mar
771,Standard Normal Variate,2020-03-18,6141,144,0,9,Mar
772,Normal Distribution,2020-03-18,4349,145,0,4,Mar
773,Quiz App in Android | Android Development for Beginners | [Hindi],2020-03-17,384,10,0,5,Mar
774,Radio Buttons in Android | Android Development for Beginners | [Hindi],2020-03-17,150,5,0,0,Mar
775,Intents in Android | Android Development for Beginners | [Hindi],2020-03-17,98,2,0,0,Mar
776,Button Counter App | Android Development for Beginners | [Hindi],2020-03-16,160,5,0,0,Mar
777,Simple Login App | Android Development for Beginners | [Hindi],2020-03-16,305,8,0,0,Mar
778,Toasts in Android | Android Development for Beginners | [Hindi],2020-03-16,194,6,0,0,Mar
779,Running our first project | Android Development for Beginners | [Hindi],2020-03-16,266,5,0,1,Mar
780,Understanding the Project Structure | Android Development for Beginners | [Hindi],2020-03-16,211,2,0,0,Mar
781,Android Virtual Device | Android Development for Beginners | [Hindi],2020-03-16,861,9,0,0,Mar
782,Rotate a Matrix by 90,2020-03-15,28,1,0,0,Mar
783,Transpose of a Matrix,2020-03-15,48,2,0,0,Mar
784,Snake Pattern,2020-03-15,1604,16,0,0,Mar
785,Matrix Introduction,2020-03-15,98,1,0,0,Mar
786,Two Pointer Approach,2020-03-15,398,2,0,0,Mar
787,Left Most Occurence Binary Search Implementation,2020-03-15,26,0,0,0,Mar
788,Binary Search Recursion,2020-03-15,170,4,0,1,Mar
789,Naive Bayes Classifier | Part 7 | Mathematics behind Naive Bayes Algorithm,2020-03-14,9472,288,0,14,Mar
790,Naive Bayes Classifier | Part 6 | Intuition,2020-03-14,10102,287,0,5,Mar
791,Naive Bayes Classifier | Part 8 | Simple Example Code,2020-03-14,11104,276,0,15,Mar
792,Naive Bayes Classifier | Part 5 | Problem based upon Bayes Theorem,2020-03-14,10199,241,0,12,Mar
793,Naive Bayes Classifier | Part 4 | Bayes Theorem in Probability,2020-03-14,9371,240,0,4,Mar
794,Naive Bayes Classifier | Part 3 | Mutually Exclusive Events,2020-03-14,8588,155,0,3,Mar
795,Naive Bayes Classifier | Part 2 | Independent Events in Probability,2020-03-14,11033,260,0,5,Mar
796,Naive Bayes Classifier | Part 1 | Conditional Probability,2020-03-14,30301,478,0,18,Mar
797,Linear Regression Part 8 | Gradient Descent | Multi-variable Gradient Descent,2020-03-13,3844,140,0,17,Mar
798,Linear Regression Part 2 - Intuition,2020-03-13,8750,282,0,31,Mar
799,Linear Regression Part 7 | Gradient Descent - Learning rate,2020-03-13,4556,124,0,4,Mar
800,Linear Regression Part 6 | Gradient Descent - Finding the Loss function and it's derivative,2020-03-13,5158,84,0,7,Mar
801,Linear Regression Part 5 | Gradient Descent - Intuition,2020-03-13,7409,193,0,13,Mar
802,Linear Regression Part 1 - Introduction,2020-03-13,15306,271,0,9,Mar
803,Leaders in an Array,2020-03-13,260,2,0,0,Mar
804,Left Rotate Array By d,2020-03-13,96,2,0,0,Mar
805,Maximum Sum Subarray Part 2Kadane's Algo,2020-03-13,24,2,0,0,Mar
806,Count Unique Elements in Sorted Array,2020-03-13,206,2,0,0,Mar
807,Maximum Sum Subarray Part 1,2020-03-13,39,1,0,0,Mar
808,Left Rotate Array By One,2020-03-13,244,2,0,0,Mar
809,Array Reversal Inplace,2020-03-13,164,3,0,0,Mar
810,Dynamic Array Implementation in Python Part 9 | Search Operation,2020-03-11,315,9,0,2,Mar
811,Dynamic Array Implementation in Python Part 8 | Pop and Clear,2020-03-11,308,8,0,1,Mar
812,Dynamic Array implementation in Python Part 7 | Deletion by value,2020-03-11,324,2,0,2,Mar
813,Dynamic Array Implementation in Python Part 6 | Deletion at a given index position,2020-03-11,510,9,0,5,Mar
814,Dynamic Array Implementation in Python Part 5 | Insertion at given index position,2020-03-11,919,12,0,4,Mar
815,Dynamic Array Implementation in Python Part 4 | Printing the Array,2020-03-11,752,4,0,4,Mar
816,Dynamic Array Implementation Part 3 | Length and Fetching item using index,2020-03-11,712,6,0,0,Mar
817,Dynamic Array implementation in Python Part 2 | Append Operation,2020-03-11,2891,22,0,6,Mar
818,Tail Recursion,2020-03-07,79,2,0,0,Mar
819,Adaboost Step 7 - Preparing data for the next stage,2020-03-06,3903,46,0,0,Mar
820,Adaboost Step 9 - Repeating the steps,2020-03-06,3274,35,0,1,Mar
821,Adaboost Step 10 - Working on a given query point,2020-03-06,2792,80,0,12,Mar
822,Adaboost Step 4 - Calculating the weight,2020-03-06,7811,95,0,10,Mar
823,Adaboost Step 5 - Adjusting the Weights,2020-03-06,5041,56,0,3,Mar
824,Adaboost Step 8 - Assigning new Weights,2020-03-06,3390,31,0,1,Mar
825,Adaboost Step 6 - Normalising the Weights,2020-03-06,3897,39,0,2,Mar
826,Adaboost Step 3 - Choosing the best Decision Stump,2020-03-06,7408,64,0,6,Mar
827,Adaboost Intuition - Part 2,2020-03-06,2975,60,0,2,Mar
828,Adaboost Step 2 - Creating all the decision stumps,2020-03-06,10033,103,0,0,Mar
829,Adaboost Intuition Part 1,2020-03-06,6864,92,0,5,Mar
830,Adaboost Step 1 - Assigning Weights,2020-03-06,8788,84,0,2,Mar
831,Studying types of data with graphs,2020-03-05,11427,326,0,13,Mar
832,Types of Data in Statistics,2020-03-05,68387,1367,0,35,Mar
833,Descriptive Statistics Vs Inferential Statistics,2020-03-05,27677,456,0,11,Mar
834,Role of Mathematics in Machine Learning,2020-03-05,10365,246,0,7,Mar
835,Boosting - Intuition,2020-03-04,3693,119,0,3,Mar
836,Why should we use Ensemble Techniques,2020-03-04,338,15,0,1,Mar
837,Input Output in Java,2020-03-03,30,1,0,0,Mar
838,Check Nth Bit is Set or Not,2020-03-03,39,0,0,0,Mar
839,Count Set Bits,2020-03-03,113,1,0,0,Mar
840,Modular Arithmetic,2020-03-03,46,0,0,0,Mar
841,Permutations and Combinations,2020-03-03,73,3,0,0,Mar
842,LCM and HCF,2020-03-03,61,0,0,0,Mar
843,Counting digits of a number,2020-03-03,109,1,0,0,Mar
844,Bitwise Left Shift Right Shift Unsigned Right Shift,2020-03-03,1089,9,0,3,Mar
845,Mean and Median,2020-03-03,426,7,0,0,Mar
846,Bitwise AND and OR operator,2020-03-03,125,1,0,0,Mar
847,Bitwise XOR Operator,2020-03-03,15,0,0,0,Mar
848,Random Forest Intuition,2020-03-03,512,21,0,1,Mar
849,Analysis of Algorithm - Part 1,2020-03-02,256,4,0,0,Mar
850,Analysis of Algorithms - Part 2,2020-03-02,86,4,0,0,Mar
851,Bagging (Bootstrap Aggregation) - Intuition,2020-03-02,1367,56,0,3,Mar
852,Ensemble Techniques in Machine Learning,2020-03-02,748,27,0,4,Mar
853,Algorithm Complexity - Big O Notation,2020-02-22,284,12,0,2,Feb
854,Binary Search Tree Implementation,2020-02-21,284,6,0,0,Feb
855,Deep Dive - Object Oriented Programming Part 2,2020-02-20,2540,75,0,8,Feb
856,Deep Dive - Object Oriented Programming Part 1,2020-02-20,7520,188,0,20,Feb
857,Dictionary and Recursion,2020-02-19,518,13,0,1,Feb
858,"Lists, Tuples and Mutability",2020-02-18,419,15,0,1,Feb
